{
  "schema_version": 1,
  "id": "d65250c-page-125",
  "document_id": "d652-50c",
  "page": 125,
  "section": "B30",
  "type": "figures",
  "titles": {
    "de": "30. Zusammenbau des Motors",
    "en-GB": "Section B.30 - Assembling the engine",
    "es-ES": "Sección B.30 - Montaje del motor"
  },
  "source": {
    "image": "source.jpg",
    "pdf_spread": 64,
    "side": "right",
    "status": "extracted_clean",
    "display_image": "source_display.jpg"
  },
  "navigation": {
    "previous": "d65250c-page-124",
    "next": "d65250c-page-126"
  },
  "paragraphs": [],
  "figures": [
    {
      "id": "d65250c-bild225",
      "number": 225,
      "captions": {
        "de": {
          "plain": "An das untere Motorengehäuse mit 14-Maulschlüssel die Ölpumpen anbauen. Die Dichtungen zwischen Pumpen und Gehäuse beachten.",
          "runs": [
            {
              "text": "An das untere Motorengehäuse mit 14-Maulschlüssel die Ölpumpen anbauen. Die Dichtungen zwischen Pumpen und Gehäuse beachten.",
              "bold": false
            }
          ]
        },
        "en-GB": {
          "plain": "Using a 14 mm open-ended spanner, fit the oil pumps to the lower engine housing. Note the gaskets between the pumps and the housing.",
          "runs": [
            {
              "text": "Using a 14 mm open-ended spanner, fit the oil pumps to the lower engine housing. Note the gaskets between the pumps and the housing.",
              "bold": false
            }
          ]
        },
        "es-ES": {
          "plain": "Con una llave fija de 14 mm, montar las bombas de aceite en la carcasa inferior del motor. Tener en cuenta las juntas entre las bombas y la carcasa.",
          "runs": [
            {
              "text": "Con una llave fija de 14 mm, montar las bombas de aceite en la carcasa inferior del motor. Tener en cuenta las juntas entre las bombas y la carcasa.",
              "bold": false
            }
          ]
        }
      },
      "label_keys": {
        "de": null,
        "en-GB": null,
        "es-ES": null
      }
    },
    {
      "id": "d65250c-bild226",
      "number": 226,
      "captions": {
        "de": {
          "plain": "Mit 14-Maulschlüssel die beiden Ölschläuche zu beiden Seiten des Motors an das Motorgehäuse anschrauben. Dichtungen beachten. Sicherungsbleche auf die Vierkantköpfe der beiden Befestigungsschrauben legen und Sicherungsbleche mit den 10-mm-Kopfschrauben festschrauben.",
          "runs": [
            {
              "text": "Mit 14-Maulschlüssel die beiden Ölschläuche zu beiden Seiten des Motors an das Motorgehäuse anschrauben. Dichtungen beachten. Sicherungsbleche auf die Vierkantköpfe der beiden Befestigungsschrauben legen und Sicherungsbleche mit den 10-mm-Kopfschrauben festschrauben.",
              "bold": false
            }
          ]
        },
        "en-GB": {
          "plain": "Using a 14 mm open-ended spanner, bolt the two oil hoses to the engine housing on both sides of the engine. Note the gaskets. Place the sheet-metal locks onto the square heads of the two fastening screws and bolt the locks down with the 10 mm cap screws.",
          "runs": [
            {
              "text": "Using a 14 mm open-ended spanner, bolt the two oil hoses to the engine housing on both sides of the engine. Note the gaskets. Place the sheet-metal locks onto the square heads of the two fastening screws and bolt the locks down with the 10 mm cap screws.",
              "bold": false
            }
          ]
        },
        "es-ES": {
          "plain": "Con una llave fija de 14 mm, atornillar las dos mangueras de aceite a la carcasa del motor en ambos lados del motor. Tener en cuenta las juntas. Colocar las chapas de seguridad sobre las cabezas cuadradas de los dos tornillos de fijación y atornillar las chapas con los tornillos de cabeza de 10 mm.",
          "runs": [
            {
              "text": "Con una llave fija de 14 mm, atornillar las dos mangueras de aceite a la carcasa del motor en ambos lados del motor. Tener en cuenta las juntas. Colocar las chapas de seguridad sobre las cabezas cuadradas de los dos tornillos de fijación y atornillar las chapas con los tornillos de cabeza de 10 mm.",
              "bold": false
            }
          ]
        }
      },
      "label_keys": {
        "de": null,
        "en-GB": null,
        "es-ES": null
      }
    }
  ],
  "status": {
    "transcription": "validated",
    "en-GB": "validated",
    "es-ES": "validated",
    "figures": "not_applicable"
  }
}
