{
  "schema_version": 1,
  "id": "d65250c-page-058",
  "document_id": "d652-50c",
  "page": 58,
  "section": "B13",
  "type": "figures",
  "titles": {
    "de": "13. Zerlegen des Motors",
    "en-GB": "Section B.13 - Dismantling the engine",
    "es-ES": "Sección B.13 - Despiece del motor"
  },
  "source": {
    "image": "source.jpg",
    "pdf_spread": 31,
    "side": "left",
    "status": "extracted_clean",
    "display_image": "source_display.jpg"
  },
  "navigation": {
    "previous": "d65250c-page-057",
    "next": "d65250c-page-059"
  },
  "paragraphs": [],
  "figures": [
    {
      "id": "d65250c-bild095",
      "number": 95,
      "captions": {
        "de": {
          "plain": "Befestigungsschrauben des Spaltfilters entsichern und diese mit 14-Maulschlüssel ausschrauben. Filter abheben.",
          "runs": [
            {
              "text": "Befestigungsschrauben des Spaltfilters entsichern und diese mit 14-Maulschlüssel ausschrauben. Filter abheben.",
              "bold": false
            }
          ]
        },
        "en-GB": {
          "plain": "Unlock the fastening screws of the slot filter and unscrew them with a 14 mm open-ended spanner. Lift off the filter.",
          "runs": [
            {
              "text": "Unlock the fastening screws of the slot filter and unscrew them with a 14 mm open-ended spanner. Lift off the filter.",
              "bold": false
            }
          ]
        },
        "es-ES": {
          "plain": "Desbloquear los tornillos de fijación del filtro de ranura y desenroscarlos con una llave fija de 14 mm. Retirar el filtro.",
          "runs": [
            {
              "text": "Desbloquear los tornillos de fijación del filtro de ranura y desenroscarlos con una llave fija de 14 mm. Retirar el filtro.",
              "bold": false
            }
          ]
        }
      },
      "label_keys": {
        "de": null,
        "en-GB": null,
        "es-ES": null
      }
    },
    {
      "id": "d65250c-bild096",
      "number": 96,
      "captions": {
        "de": {
          "plain": "Mit 14-Maulschlüssel die Befestigungsschrauben der drei Ölpumpen entfernen und diese abheben.",
          "runs": [
            {
              "text": "Mit 14-Maulschlüssel die Befestigungsschrauben der drei Ölpumpen entfernen und diese abheben.",
              "bold": false
            }
          ]
        },
        "en-GB": {
          "plain": "Using a 14 mm open-ended spanner, remove the fastening screws of the three oil pumps and lift them off.",
          "runs": [
            {
              "text": "Using a 14 mm open-ended spanner, remove the fastening screws of the three oil pumps and lift them off.",
              "bold": false
            }
          ]
        },
        "es-ES": {
          "plain": "Con una llave fija de 14 mm, retirar los tornillos de fijación de las tres bombas de aceite y retirarlas.",
          "runs": [
            {
              "text": "Con una llave fija de 14 mm, retirar los tornillos de fijación de las tres bombas de aceite y retirarlas.",
              "bold": false
            }
          ]
        }
      },
      "label_keys": {
        "de": null,
        "en-GB": null,
        "es-ES": null
      }
    }
  ],
  "status": {
    "transcription": "validated",
    "en-GB": "validated",
    "es-ES": "validated",
    "figures": "not_applicable"
  }
}
