{
  "schema_version": 1,
  "id": "d65250c-page-042",
  "document_id": "d652-50c",
  "page": 42,
  "section": "B12",
  "type": "figures",
  "titles": {
    "de": "12. Ausbauen des Motors",
    "en-GB": "Section B.12 - Removing the engine",
    "es-ES": "Sección B.12 - Desmontaje del motor"
  },
  "source": {
    "image": "source.jpg",
    "pdf_spread": 23,
    "side": "left",
    "status": "extracted_clean",
    "display_image": "source_display.jpg"
  },
  "navigation": {
    "previous": "d65250c-page-041",
    "next": "d65250c-page-043"
  },
  "paragraphs": [],
  "figures": [
    {
      "id": "d65250c-bild063",
      "number": 63,
      "captions": {
        "de": {
          "plain": "Mit 17-Maulschlüssel die hintere Motorbefestigungsschraube unterhalb der Lichtmaschine abschrauben.",
          "runs": [
            {
              "text": "Mit 17-Maulschlüssel die hintere Motorbefestigungsschraube unterhalb der Lichtmaschine abschrauben.",
              "bold": false
            }
          ]
        },
        "en-GB": {
          "plain": "Using a 17 mm open-ended spanner, unscrew the rear engine-fastening screw below the dynamo.",
          "runs": [
            {
              "text": "Using a 17 mm open-ended spanner, unscrew the rear engine-fastening screw below the dynamo.",
              "bold": false
            }
          ]
        },
        "es-ES": {
          "plain": "Con una llave fija de 17 mm, desenroscar el tornillo de fijación trasero del motor bajo la dinamo.",
          "runs": [
            {
              "text": "Con una llave fija de 17 mm, desenroscar el tornillo de fijación trasero del motor bajo la dinamo.",
              "bold": false
            }
          ]
        }
      },
      "label_keys": {
        "de": null,
        "en-GB": null,
        "es-ES": null
      }
    },
    {
      "id": "d65250c-bild064",
      "number": 64,
      "captions": {
        "de": {
          "plain": "Mit 14- und 17-Maulschlüssel die Schrauben aus dem Gelenkwellentunnel und dem Kupplungsvorbau entfernen.",
          "runs": [
            {
              "text": "Mit 14- und 17-Maulschlüssel die Schrauben aus dem Gelenkwellentunnel und dem Kupplungsvorbau entfernen.",
              "bold": false
            }
          ]
        },
        "en-GB": {
          "plain": "Using 14 mm and 17 mm open-ended spanners, remove the screws from the cardan-shaft tunnel and the clutch housing extension (Kupplungsvorbau).",
          "runs": [
            {
              "text": "Using 14 mm and 17 mm open-ended spanners, remove the screws from the cardan-shaft tunnel and the clutch housing extension (Kupplungsvorbau).",
              "bold": false
            }
          ]
        },
        "es-ES": {
          "plain": "Con llaves fijas de 14 y 17 mm, retirar los tornillos del túnel del árbol de transmisión y de la prolongación de la carcasa del embrague (Kupplungsvorbau).",
          "runs": [
            {
              "text": "Con llaves fijas de 14 y 17 mm, retirar los tornillos del túnel del árbol de transmisión y de la prolongación de la carcasa del embrague (Kupplungsvorbau).",
              "bold": false
            }
          ]
        }
      },
      "label_keys": {
        "de": null,
        "en-GB": null,
        "es-ES": null
      }
    }
  ],
  "status": {
    "transcription": "validated",
    "en-GB": "validated",
    "es-ES": "validated",
    "figures": "not_applicable"
  }
}
