{
  "schema_version": 1,
  "id": "d65250c-page-049",
  "document_id": "d652-50c",
  "page": 49,
  "section": "B13",
  "type": "figures",
  "titles": {
    "de": "13. Zerlegen des Motors",
    "en-GB": "Section B.13 - Dismantling the engine",
    "es-ES": "Sección B.13 - Despiece del motor"
  },
  "source": {
    "image": "source.jpg",
    "pdf_spread": 26,
    "side": "right",
    "status": "extracted_clean",
    "display_image": "source_display.jpg"
  },
  "navigation": {
    "previous": "d65250c-page-048",
    "next": "d65250c-page-050"
  },
  "paragraphs": [],
  "figures": [
    {
      "id": "d65250c-bild077",
      "number": 77,
      "captions": {
        "de": {
          "plain": "Mit 20-Maulschlüssel die Befestigungsschrauben des Leitungabschlußdeckels herausschrauben und Deckel abheben.",
          "runs": [
            {
              "text": "Mit 20-Maulschlüssel die Befestigungsschrauben des Leitungabschlußdeckels herausschrauben und Deckel abheben.",
              "bold": false
            }
          ]
        },
        "en-GB": {
          "plain": "Using a 20 mm open-ended spanner, unscrew the fastening screws of the lead terminal cover and lift off the cover.",
          "runs": [
            {
              "text": "Using a 20 mm open-ended spanner, unscrew the fastening screws of the lead terminal cover and lift off the cover.",
              "bold": false
            }
          ]
        },
        "es-ES": {
          "plain": "Con una llave fija de 20 mm, desenroscar los tornillos de fijación de la tapa terminal de los cables y retirar la tapa.",
          "runs": [
            {
              "text": "Con una llave fija de 20 mm, desenroscar los tornillos de fijación de la tapa terminal de los cables y retirar la tapa.",
              "bold": false
            }
          ]
        }
      },
      "label_keys": {
        "de": null,
        "en-GB": null,
        "es-ES": null
      }
    },
    {
      "id": "d65250c-bild078",
      "number": 78,
      "captions": {
        "de": {
          "plain": "Mit Schraubenzieher aus den Zündkerzensteckern die Aufsteckschrauben herausschrauben. Leitung durch die Stecker schieben und die Kontaktschrauben ausschrauben. Stecker von den Leitungen abziehen.",
          "runs": [
            {
              "text": "Mit Schraubenzieher aus den Zündkerzensteckern die Aufsteckschrauben herausschrauben. Leitung durch die Stecker schieben und die Kontaktschrauben ausschrauben. Stecker von den Leitungen abziehen.",
              "bold": false
            }
          ]
        },
        "en-GB": {
          "plain": "Using a screwdriver, unscrew the retaining screws from the spark-plug caps. Slide the lead through the caps and unscrew the contact screws. Pull the caps off the leads.",
          "runs": [
            {
              "text": "Using a screwdriver, unscrew the retaining screws from the spark-plug caps. Slide the lead through the caps and unscrew the contact screws. Pull the caps off the leads.",
              "bold": false
            }
          ]
        },
        "es-ES": {
          "plain": "Con un destornillador, desenroscar los tornillos de sujeción de los capuchones de las bujías. Pasar el cable por los capuchones y desenroscar los tornillos de contacto. Sacar los capuchones de los cables.",
          "runs": [
            {
              "text": "Con un destornillador, desenroscar los tornillos de sujeción de los capuchones de las bujías. Pasar el cable por los capuchones y desenroscar los tornillos de contacto. Sacar los capuchones de los cables.",
              "bold": false
            }
          ]
        }
      },
      "label_keys": {
        "de": null,
        "en-GB": null,
        "es-ES": null
      }
    }
  ],
  "status": {
    "transcription": "validated",
    "en-GB": "validated",
    "es-ES": "validated",
    "figures": "not_applicable"
  }
}
