{
  "schema_version": 1,
  "id": "d65250c-page-089",
  "document_id": "d652-50c",
  "page": 89,
  "section": "B22",
  "type": "figures",
  "titles": {
    "de": "22. Zerlegen der Lichtmaschine",
    "en-GB": "Section B.22 - Dismantling the dynamo",
    "es-ES": "Sección B.22 - Desarmado de la dinamo"
  },
  "source": {
    "image": "source.jpg",
    "pdf_spread": 46,
    "side": "right",
    "status": "extracted_clean",
    "display_image": "source_display.jpg"
  },
  "navigation": {
    "previous": "d65250c-page-088",
    "next": "d65250c-page-090"
  },
  "paragraphs": [],
  "figures": [
    {
      "id": "d65250c-bild156",
      "number": 156,
      "captions": {
        "de": {
          "plain": "Mit Schraubenzieher die Schrauben aus der Schutzkappe entfernen und diese abheben.",
          "runs": [
            {
              "text": "Mit Schraubenzieher die Schrauben aus der Schutzkappe entfernen und diese abheben.",
              "bold": false
            }
          ]
        },
        "en-GB": {
          "plain": "Using a screwdriver, remove the screws from the protective cap and lift it off.",
          "runs": [
            {
              "text": "Using a screwdriver, remove the screws from the protective cap and lift it off.",
              "bold": false
            }
          ]
        },
        "es-ES": {
          "plain": "Con un destornillador, retirar los tornillos de la tapa protectora y retirarla.",
          "runs": [
            {
              "text": "Con un destornillador, retirar los tornillos de la tapa protectora y retirarla.",
              "bold": false
            }
          ]
        }
      },
      "label_keys": {
        "de": null,
        "en-GB": null,
        "es-ES": null
      }
    },
    {
      "id": "d65250c-bild157",
      "number": 157,
      "captions": {
        "de": {
          "plain": "Mit Schraubenzieher die Schraube an der auszuwechselnden Kohlebürste entfernen.",
          "runs": [
            {
              "text": "Mit Schraubenzieher die Schraube an der auszuwechselnden Kohlebürste entfernen.",
              "bold": false
            }
          ]
        },
        "en-GB": {
          "plain": "Using a screwdriver, remove the screw from the carbon brush to be replaced.",
          "runs": [
            {
              "text": "Using a screwdriver, remove the screw from the carbon brush to be replaced.",
              "bold": false
            }
          ]
        },
        "es-ES": {
          "plain": "Con un destornillador, retirar el tornillo de la escobilla de carbón que se va a sustituir.",
          "runs": [
            {
              "text": "Con un destornillador, retirar el tornillo de la escobilla de carbón que se va a sustituir.",
              "bold": false
            }
          ]
        }
      },
      "label_keys": {
        "de": null,
        "en-GB": null,
        "es-ES": null
      }
    }
  ],
  "status": {
    "transcription": "validated",
    "en-GB": "validated",
    "es-ES": "validated",
    "figures": "not_applicable"
  }
}
