{
  "schema_version": 1,
  "id": "d65250c-page-020",
  "document_id": "d652-50c",
  "page": 20,
  "section": "A05",
  "type": "figures",
  "titles": {
    "de": "5. Ausbauen des rechten Lüfters und Kühlers",
    "en-GB": "Section A.5 - Removing the right-hand fan and radiator",
    "es-ES": "Sección A.5 - Desmontaje del ventilador y radiador derechos"
  },
  "source": {
    "image": "source.jpg",
    "pdf_spread": 12,
    "side": "left",
    "status": "extracted_clean",
    "display_image": "source_display.jpg"
  },
  "navigation": {
    "previous": "d65250c-page-019",
    "next": "d65250c-page-021"
  },
  "paragraphs": [],
  "figures": [
    {
      "id": "d65250c-bild027",
      "number": 27,
      "captions": {
        "de": {
          "plain": "Befestigungsschrauben der schräg nach unten verlaufenden Schutzplatte des Kraftstoffbehälters entsichern und diese mit 14-Steckschlüssel (Knarre) ausschrauben. Platte abheben.",
          "runs": [
            {
              "text": "Befestigungsschrauben der schräg nach unten verlaufenden Schutzplatte des Kraftstoffbehälters entsichern und diese mit 14-Steckschlüssel (Knarre) ausschrauben. Platte abheben.",
              "bold": false
            }
          ]
        },
        "en-GB": {
          "plain": "Unlock the fastening screws of the protective plate that runs diagonally downward in front of the fuel tank and unscrew them with a 14 mm socket wrench (ratchet). Lift off the plate.",
          "runs": [
            {
              "text": "Unlock the fastening screws of the protective plate that runs diagonally downward in front of the fuel tank and unscrew them with a 14 mm socket wrench (ratchet). Lift off the plate.",
              "bold": false
            }
          ]
        },
        "es-ES": {
          "plain": "Desbloquear los tornillos de fijación de la placa protectora que discurre en diagonal hacia abajo delante del depósito de combustible y desenroscarlos con una llave de vaso (carraca) de 14 mm. Retirar la placa.",
          "runs": [
            {
              "text": "Desbloquear los tornillos de fijación de la placa protectora que discurre en diagonal hacia abajo delante del depósito de combustible y desenroscarlos con una llave de vaso (carraca) de 14 mm. Retirar la placa.",
              "bold": false
            }
          ]
        }
      },
      "label_keys": {
        "de": null,
        "en-GB": null,
        "es-ES": null
      }
    },
    {
      "id": "d65250c-bild028",
      "number": 28,
      "captions": {
        "de": {
          "plain": "Splinte aus den Kronenmuttern entfernen und beide vorderen Kühlerbefestigungsschrauben mit zwei 17-Maulschlüsseln ausschrauben. Kühler ausheben.",
          "runs": [
            {
              "text": "Splinte aus den Kronenmuttern entfernen und beide vorderen Kühlerbefestigungsschrauben mit zwei 17-Maulschlüsseln ausschrauben. Kühler ausheben.",
              "bold": false
            }
          ]
        },
        "en-GB": {
          "plain": "Remove the split pins from the castle nuts and unscrew both front radiator-fastening screws with two 17 mm open-ended spanners. Lift out the radiator.",
          "runs": [
            {
              "text": "Remove the split pins from the castle nuts and unscrew both front radiator-fastening screws with two 17 mm open-ended spanners. Lift out the radiator.",
              "bold": false
            }
          ]
        },
        "es-ES": {
          "plain": "Retirar los pasadores de aletas de las tuercas almenadas y desenroscar los dos tornillos de fijación delanteros del radiador con dos llaves fijas de 17 mm. Extraer el radiador.",
          "runs": [
            {
              "text": "Retirar los pasadores de aletas de las tuercas almenadas y desenroscar los dos tornillos de fijación delanteros del radiador con dos llaves fijas de 17 mm. Extraer el radiador.",
              "bold": false
            }
          ]
        }
      },
      "label_keys": {
        "de": null,
        "en-GB": null,
        "es-ES": null
      }
    }
  ],
  "status": {
    "transcription": "validated",
    "en-GB": "validated",
    "es-ES": "validated",
    "figures": "not_applicable"
  }
}
