{
  "schema_version": 1,
  "id": "d65250c-page-055",
  "document_id": "d652-50c",
  "page": 55,
  "section": "B13",
  "type": "figures",
  "titles": {
    "de": "13. Zerlegen des Motors",
    "en-GB": "Section B.13 - Dismantling the engine",
    "es-ES": "Sección B.13 - Despiece del motor"
  },
  "source": {
    "image": "source.jpg",
    "pdf_spread": 29,
    "side": "right",
    "status": "extracted_clean",
    "display_image": "source_display.jpg"
  },
  "navigation": {
    "previous": "d65250c-page-054",
    "next": "d65250c-page-056"
  },
  "paragraphs": [],
  "figures": [
    {
      "id": "d65250c-bild089",
      "number": 89,
      "captions": {
        "de": {
          "plain": "Mit 14-Steck- und Maulschlüssel die Befestigungsschrauben des Ölbehälters entfernen, diesen abheben.",
          "runs": [
            {
              "text": "Mit 14-Steck- und Maulschlüssel die Befestigungsschrauben des Ölbehälters entfernen, diesen abheben.",
              "bold": false
            }
          ]
        },
        "en-GB": {
          "plain": "Using 14 mm socket and open-ended spanners, remove the fastening screws of the oil tank and lift it off.",
          "runs": [
            {
              "text": "Using 14 mm socket and open-ended spanners, remove the fastening screws of the oil tank and lift it off.",
              "bold": false
            }
          ]
        },
        "es-ES": {
          "plain": "Con llaves de vaso y fija de 14 mm, retirar los tornillos de fijación del depósito de aceite y retirarlo.",
          "runs": [
            {
              "text": "Con llaves de vaso y fija de 14 mm, retirar los tornillos de fijación del depósito de aceite y retirarlo.",
              "bold": false
            }
          ]
        }
      },
      "label_keys": {
        "de": null,
        "en-GB": null,
        "es-ES": null
      }
    },
    {
      "id": "d65250c-bild090",
      "number": 90,
      "captions": {
        "de": {
          "plain": "Mit 14-Maulschlüssel die vier Befestigungsschrauben des elektrischen Anlassers entfernen und Spannschellen und Anlasser abheben.",
          "runs": [
            {
              "text": "Mit 14-Maulschlüssel die vier Befestigungsschrauben des elektrischen Anlassers entfernen und Spannschellen und Anlasser abheben.",
              "bold": false
            }
          ]
        },
        "en-GB": {
          "plain": "Using a 14 mm open-ended spanner, remove the four fastening screws of the electric starter and lift off the clamp collars and the starter.",
          "runs": [
            {
              "text": "Using a 14 mm open-ended spanner, remove the four fastening screws of the electric starter and lift off the clamp collars and the starter.",
              "bold": false
            }
          ]
        },
        "es-ES": {
          "plain": "Con una llave fija de 14 mm, retirar los cuatro tornillos de fijación del motor de arranque eléctrico y retirar las abrazaderas y el motor de arranque.",
          "runs": [
            {
              "text": "Con una llave fija de 14 mm, retirar los cuatro tornillos de fijación del motor de arranque eléctrico y retirar las abrazaderas y el motor de arranque.",
              "bold": false
            }
          ]
        }
      },
      "label_keys": {
        "de": null,
        "en-GB": null,
        "es-ES": null
      }
    }
  ],
  "status": {
    "transcription": "validated",
    "en-GB": "validated",
    "es-ES": "validated",
    "figures": "not_applicable"
  }
}
