{
  "schema_version": 1,
  "id": "d65250c-page-119",
  "document_id": "d652-50c",
  "page": 119,
  "section": "B29",
  "type": "figures",
  "titles": {
    "de": "29. Zerlegen und Reinigen des Kraftstoffilters",
    "en-GB": "Section B.29 - Dismantling and cleaning the fuel filter",
    "es-ES": "Sección B.29 - Desmontaje y limpieza del filtro de combustible"
  },
  "source": {
    "image": "source.jpg",
    "pdf_spread": 61,
    "side": "right",
    "status": "extracted_clean",
    "display_image": "source_display.jpg"
  },
  "navigation": {
    "previous": "d65250c-page-118",
    "next": "d65250c-page-120"
  },
  "paragraphs": [],
  "figures": [
    {
      "id": "d65250c-bild213",
      "number": 213,
      "captions": {
        "de": {
          "plain": "Mit 11-Maulschlüssel die vier Befestigungsmuttern des Gehäusedeckels entfernen.",
          "runs": [
            {
              "text": "Mit 11-Maulschlüssel die vier Befestigungsmuttern des Gehäusedeckels entfernen.",
              "bold": false
            }
          ]
        },
        "en-GB": {
          "plain": "Using an 11 mm open-ended spanner, remove the four fastening nuts of the housing cover.",
          "runs": [
            {
              "text": "Using an 11 mm open-ended spanner, remove the four fastening nuts of the housing cover.",
              "bold": false
            }
          ]
        },
        "es-ES": {
          "plain": "Con una llave fija de 11 mm, retirar las cuatro tuercas de fijación de la tapa de la carcasa.",
          "runs": [
            {
              "text": "Con una llave fija de 11 mm, retirar las cuatro tuercas de fijación de la tapa de la carcasa.",
              "bold": false
            }
          ]
        }
      },
      "label_keys": {
        "de": null,
        "en-GB": null,
        "es-ES": null
      }
    },
    {
      "id": "d65250c-bild214",
      "number": 214,
      "captions": {
        "de": {
          "plain": "Gehäusedeckel abnehmen und Filtereinsatz ausheben.",
          "runs": [
            {
              "text": "Gehäusedeckel abnehmen und Filtereinsatz ausheben.",
              "bold": false
            }
          ]
        },
        "en-GB": {
          "plain": "Remove the housing cover and lift out the filter element.",
          "runs": [
            {
              "text": "Remove the housing cover and lift out the filter element.",
              "bold": false
            }
          ]
        },
        "es-ES": {
          "plain": "Retirar la tapa de la carcasa y extraer el elemento filtrante.",
          "runs": [
            {
              "text": "Retirar la tapa de la carcasa y extraer el elemento filtrante.",
              "bold": false
            }
          ]
        }
      },
      "label_keys": {
        "de": null,
        "en-GB": null,
        "es-ES": null
      }
    }
  ],
  "status": {
    "transcription": "validated",
    "en-GB": "validated",
    "es-ES": "validated",
    "figures": "not_applicable"
  }
}
