{
  "schema_version": 1,
  "id": "d65250c-page-036",
  "document_id": "d652-50c",
  "page": 36,
  "section": "B12",
  "type": "figures",
  "titles": {
    "de": "12. Ausbauen des Motors",
    "en-GB": "Section B.12 - Removing the engine",
    "es-ES": "Sección B.12 - Desmontaje del motor"
  },
  "source": {
    "image": "source.jpg",
    "pdf_spread": 20,
    "side": "left",
    "status": "extracted_clean",
    "display_image": "source_display.jpg"
  },
  "navigation": {
    "previous": "d65250c-page-035",
    "next": "d65250c-page-037"
  },
  "paragraphs": [],
  "figures": [
    {
      "id": "d65250c-bild051",
      "number": 51,
      "captions": {
        "de": {
          "plain": "Mit 14-Maulschlüssel die Befestigungsschraube der Masseleitung an der Wasserpumpenseite des Motors entfernen.",
          "runs": [
            {
              "text": "Mit 14-Maulschlüssel die Befestigungsschraube der Masseleitung an der Wasserpumpenseite des Motors entfernen.",
              "bold": false
            }
          ]
        },
        "en-GB": {
          "plain": "Using a 14 mm open-ended spanner, remove the fastening screw of the earth lead on the water-pump side of the engine.",
          "runs": [
            {
              "text": "Using a 14 mm open-ended spanner, remove the fastening screw of the earth lead on the water-pump side of the engine.",
              "bold": false
            }
          ]
        },
        "es-ES": {
          "plain": "Con una llave fija de 14 mm, retirar el tornillo de fijación del cable de masa en el lado de la bomba de agua del motor.",
          "runs": [
            {
              "text": "Con una llave fija de 14 mm, retirar el tornillo de fijación del cable de masa en el lado de la bomba de agua del motor.",
              "bold": false
            }
          ]
        }
      },
      "label_keys": {
        "de": null,
        "en-GB": null,
        "es-ES": null
      }
    },
    {
      "id": "d65250c-bild052",
      "number": 52,
      "captions": {
        "de": {
          "plain": "Mit 17-Ringschlüssel die Schraube der Masseleitung an der vorderen linken Motor-Aufhängung entfernen.",
          "runs": [
            {
              "text": "Mit 17-Ringschlüssel die Schraube der Masseleitung an der vorderen linken Motor-Aufhängung entfernen.",
              "bold": false
            }
          ]
        },
        "en-GB": {
          "plain": "Using a 17 mm ring spanner, remove the screw of the earth lead at the front left-hand engine mount.",
          "runs": [
            {
              "text": "Using a 17 mm ring spanner, remove the screw of the earth lead at the front left-hand engine mount.",
              "bold": false
            }
          ]
        },
        "es-ES": {
          "plain": "Con una llave de estrella de 17 mm, retirar el tornillo del cable de masa en el soporte de motor delantero izquierdo.",
          "runs": [
            {
              "text": "Con una llave de estrella de 17 mm, retirar el tornillo del cable de masa en el soporte de motor delantero izquierdo.",
              "bold": false
            }
          ]
        }
      },
      "label_keys": {
        "de": null,
        "en-GB": null,
        "es-ES": null
      }
    }
  ],
  "status": {
    "transcription": "validated",
    "en-GB": "validated",
    "es-ES": "validated",
    "figures": "not_applicable"
  }
}
