{
  "schema_version": 1,
  "id": "d65250c-page-129",
  "document_id": "d652-50c",
  "page": 129,
  "section": "B30",
  "type": "figures",
  "titles": {
    "de": "30. Zusammenbau des Motors",
    "en-GB": "Section B.30 - Assembling the engine",
    "es-ES": "Sección B.30 - Montaje del motor"
  },
  "source": {
    "image": "source.jpg",
    "pdf_spread": 66,
    "side": "right",
    "status": "extracted_clean",
    "display_image": "source_display.jpg"
  },
  "navigation": {
    "previous": "d65250c-page-128",
    "next": "d65250c-page-130"
  },
  "paragraphs": [],
  "figures": [
    {
      "id": "d65250c-bild233",
      "number": 233,
      "captions": {
        "de": {
          "plain": "Mit 14-Maulschlüssel den Abschlußdeckel der Antriebswelle für die Öl- und Kraftstoffpumpen festschrauben.",
          "runs": [
            {
              "text": "Mit 14-Maulschlüssel den Abschlußdeckel der Antriebswelle für die Öl- und Kraftstoffpumpen festschrauben.",
              "bold": false
            }
          ]
        },
        "en-GB": {
          "plain": "Using a 14 mm open-ended spanner, bolt down the end cover of the drive shaft for the oil and fuel pumps.",
          "runs": [
            {
              "text": "Using a 14 mm open-ended spanner, bolt down the end cover of the drive shaft for the oil and fuel pumps.",
              "bold": false
            }
          ]
        },
        "es-ES": {
          "plain": "Con una llave fija de 14 mm, atornillar la tapa de cierre del eje de accionamiento de las bombas de aceite y combustible.",
          "runs": [
            {
              "text": "Con una llave fija de 14 mm, atornillar la tapa de cierre del eje de accionamiento de las bombas de aceite y combustible.",
              "bold": false
            }
          ]
        }
      },
      "label_keys": {
        "de": null,
        "en-GB": null,
        "es-ES": null
      }
    },
    {
      "id": "d65250c-bild234",
      "number": 234,
      "captions": {
        "de": {
          "plain": "Stütze der Motoraufhängung auf die Nabe des Motors schieben. Abschlußplatte vorlegen und Senkschrauben einschrauben. Senkschrauben durch Körnerschlag sichern.",
          "runs": [
            {
              "text": "Stütze der Motoraufhängung auf die Nabe des Motors schieben. Abschlußplatte vorlegen und Senkschrauben einschrauben. Senkschrauben durch Körnerschlag sichern.",
              "bold": false
            }
          ]
        },
        "en-GB": {
          "plain": "Slide the engine-mount bracket onto the engine hub. Place the end plate in position and screw in the countersunk screws. Secure the countersunk screws with a centre-punch mark.",
          "runs": [
            {
              "text": "Slide the engine-mount bracket onto the engine hub. Place the end plate in position and screw in the countersunk screws. Secure the countersunk screws with a centre-punch mark.",
              "bold": false
            }
          ]
        },
        "es-ES": {
          "plain": "Deslizar el soporte de montaje del motor sobre el cubo del motor. Colocar la placa de cierre y enroscar los tornillos avellanados. Asegurar los tornillos avellanados con una marca de granete.",
          "runs": [
            {
              "text": "Deslizar el soporte de montaje del motor sobre el cubo del motor. Colocar la placa de cierre y enroscar los tornillos avellanados. Asegurar los tornillos avellanados con una marca de granete.",
              "bold": false
            }
          ]
        }
      },
      "label_keys": {
        "de": null,
        "en-GB": null,
        "es-ES": null
      }
    }
  ],
  "status": {
    "transcription": "validated",
    "en-GB": "validated",
    "es-ES": "validated",
    "figures": "not_applicable"
  }
}
