{
  "schema_version": 1,
  "id": "d65250c-page-066",
  "document_id": "d652-50c",
  "page": 66,
  "section": "B13",
  "type": "figures",
  "titles": {
    "de": "13. Zerlegen des Motors",
    "en-GB": "Section B.13 - Dismantling the engine",
    "es-ES": "Sección B.13 - Despiece del motor"
  },
  "source": {
    "image": "source.jpg",
    "pdf_spread": 35,
    "side": "left",
    "status": "extracted_clean",
    "display_image": "source_display.jpg"
  },
  "navigation": {
    "previous": "d65250c-page-065",
    "next": "d65250c-page-067"
  },
  "paragraphs": [],
  "figures": [
    {
      "id": "d65250c-bild111",
      "number": 111,
      "captions": {
        "de": {
          "plain": "Mit Dorn die Pleuelschrauben ausschlagen. Lagerschale abheben.",
          "runs": [
            {
              "text": "Mit Dorn die Pleuelschrauben ausschlagen. Lagerschale abheben.",
              "bold": false
            }
          ]
        },
        "en-GB": {
          "plain": "Using a punch, knock out the connecting-rod bolts. Lift off the bearing shell.",
          "runs": [
            {
              "text": "Using a punch, knock out the connecting-rod bolts. Lift off the bearing shell.",
              "bold": false
            }
          ]
        },
        "es-ES": {
          "plain": "Con un punzón, extraer a golpes los tornillos de biela. Retirar el semicasquillo de cojinete.",
          "runs": [
            {
              "text": "Con un punzón, extraer a golpes los tornillos de biela. Retirar el semicasquillo de cojinete.",
              "bold": false
            }
          ]
        }
      },
      "label_keys": {
        "de": null,
        "en-GB": null,
        "es-ES": null
      }
    },
    {
      "id": "d65250c-bild112",
      "number": 112,
      "captions": {
        "de": {
          "plain": "Mit einem Holzklotz Pleuelstange mit Kolben durch die Zylinderlaufbuchse herausschlagen.",
          "runs": [
            {
              "text": "Mit einem Holzklotz Pleuelstange mit Kolben durch die Zylinderlaufbuchse herausschlagen.",
              "bold": false
            }
          ]
        },
        "en-GB": {
          "plain": "Using a wooden block, knock the connecting rod with the piston out through the cylinder liner.",
          "runs": [
            {
              "text": "Using a wooden block, knock the connecting rod with the piston out through the cylinder liner.",
              "bold": false
            }
          ]
        },
        "es-ES": {
          "plain": "Con un taco de madera, sacar a golpes la biela con el pistón a través de la camisa del cilindro.",
          "runs": [
            {
              "text": "Con un taco de madera, sacar a golpes la biela con el pistón a través de la camisa del cilindro.",
              "bold": false
            }
          ]
        }
      },
      "label_keys": {
        "de": null,
        "en-GB": null,
        "es-ES": null
      }
    }
  ],
  "status": {
    "transcription": "validated",
    "en-GB": "validated",
    "es-ES": "validated",
    "figures": "not_applicable"
  }
}
