{
  "schema_version": 1,
  "id": "d65250c-page-041",
  "document_id": "d652-50c",
  "page": 41,
  "section": "B12",
  "type": "figures",
  "titles": {
    "de": "12. Ausbauen des Motors",
    "en-GB": "Section B.12 - Removing the engine",
    "es-ES": "Sección B.12 - Desmontaje del motor"
  },
  "source": {
    "image": "source.jpg",
    "pdf_spread": 22,
    "side": "right",
    "status": "extracted_clean",
    "display_image": "source_display.jpg"
  },
  "navigation": {
    "previous": "d65250c-page-040",
    "next": "d65250c-page-042"
  },
  "paragraphs": [],
  "figures": [
    {
      "id": "d65250c-bild061",
      "number": 61,
      "captions": {
        "de": {
          "plain": "Mit 17-Maulschlüssel die Ölleitung am Spaltfilter abschrauben.",
          "runs": [
            {
              "text": "Mit 17-Maulschlüssel die Ölleitung am Spaltfilter abschrauben.",
              "bold": false
            }
          ]
        },
        "en-GB": {
          "plain": "Using a 17 mm open-ended spanner, unscrew the oil line at the slot filter.",
          "runs": [
            {
              "text": "Using a 17 mm open-ended spanner, unscrew the oil line at the slot filter.",
              "bold": false
            }
          ]
        },
        "es-ES": {
          "plain": "Con una llave fija de 17 mm, desenroscar la tubería de aceite en el filtro de ranura.",
          "runs": [
            {
              "text": "Con una llave fija de 17 mm, desenroscar la tubería de aceite en el filtro de ranura.",
              "bold": false
            }
          ]
        }
      },
      "label_keys": {
        "de": null,
        "en-GB": null,
        "es-ES": null
      }
    },
    {
      "id": "d65250c-bild062",
      "number": 62,
      "captions": {
        "de": {
          "plain": "Mit 17-Maulschlüssel die hintere Motorbefestigungsschraube unterhalb des Ölkühlers abschrauben.",
          "runs": [
            {
              "text": "Mit 17-Maulschlüssel die hintere Motorbefestigungsschraube unterhalb des Ölkühlers abschrauben.",
              "bold": false
            }
          ]
        },
        "en-GB": {
          "plain": "Using a 17 mm open-ended spanner, unscrew the rear engine-fastening screw below the oil cooler.",
          "runs": [
            {
              "text": "Using a 17 mm open-ended spanner, unscrew the rear engine-fastening screw below the oil cooler.",
              "bold": false
            }
          ]
        },
        "es-ES": {
          "plain": "Con una llave fija de 17 mm, desenroscar el tornillo de fijación trasero del motor bajo el radiador de aceite.",
          "runs": [
            {
              "text": "Con una llave fija de 17 mm, desenroscar el tornillo de fijación trasero del motor bajo el radiador de aceite.",
              "bold": false
            }
          ]
        }
      },
      "label_keys": {
        "de": null,
        "en-GB": null,
        "es-ES": null
      }
    }
  ],
  "status": {
    "transcription": "validated",
    "en-GB": "validated",
    "es-ES": "validated",
    "figures": "not_applicable"
  }
}
