{
  "schema_version": 1,
  "id": "d65250c-page-026",
  "document_id": "d652-50c",
  "page": 26,
  "section": "A09",
  "type": "figures",
  "titles": {
    "de": "9. Abbauen des Bugpanzers",
    "en-GB": "Section A.9 - Removing the front superstructure armour",
    "es-ES": "Sección A.9 - Desmontaje de la superestructura frontal blindada"
  },
  "source": {
    "image": "source.jpg",
    "pdf_spread": 15,
    "side": "left",
    "status": "extracted_clean",
    "display_image": "source_display.jpg"
  },
  "navigation": {
    "previous": "d65250c-page-025",
    "next": "d65250c-page-027"
  },
  "paragraphs": [],
  "figures": [
    {
      "id": "d65250c-bild033",
      "number": 33,
      "captions": {
        "de": {
          "plain": "An der hinteren Trennwand innerhalb des Kampfraumes die Befestigungsschrauben des Bugpanzers entsichern und diese mit 19-Maulschlüssel entfernen.",
          "runs": [
            {
              "text": "An der hinteren Trennwand innerhalb des Kampfraumes die Befestigungsschrauben des Bugpanzers entsichern und diese mit 19-Maulschlüssel entfernen.",
              "bold": false
            }
          ]
        },
        "en-GB": {
          "plain": "At the rear bulkhead inside the fighting compartment, unlock the fastening screws of the front superstructure armour and remove them with a 19 mm open-ended spanner.",
          "runs": [
            {
              "text": "At the rear bulkhead inside the fighting compartment, unlock the fastening screws of the front superstructure armour and remove them with a 19 mm open-ended spanner.",
              "bold": false
            }
          ]
        },
        "es-ES": {
          "plain": "En el mamparo trasero, dentro de la cámara de combate, desbloquear los tornillos de fijación de la superestructura frontal blindada y retirarlos con una llave fija de 19 mm.",
          "runs": [
            {
              "text": "En el mamparo trasero, dentro de la cámara de combate, desbloquear los tornillos de fijación de la superestructura frontal blindada y retirarlos con una llave fija de 19 mm.",
              "bold": false
            }
          ]
        }
      },
      "label_keys": {
        "de": null,
        "en-GB": null,
        "es-ES": null
      }
    },
    {
      "id": "d65250c-bild034",
      "number": 34,
      "captions": {
        "de": {
          "plain": "Mit 10-Maulschlüssel die Mutter von dem Keilbolzen an dem Lüfterklappenverstellhebel entfernen und Keilbolzen ausschlagen. Welle mit Gestänge vom Motorraum aus zurückziehen.",
          "runs": [
            {
              "text": "Mit 10-Maulschlüssel die Mutter von dem Keilbolzen an dem Lüfterklappenverstellhebel entfernen und Keilbolzen ausschlagen. Welle mit Gestänge vom Motorraum aus zurückziehen.",
              "bold": false
            }
          ]
        },
        "en-GB": {
          "plain": "Using a 10 mm open-ended spanner, remove the nut from the wedge pin on the fan-flap actuating lever and drive out the wedge pin. Withdraw the shaft with its linkage from the engine compartment.",
          "runs": [
            {
              "text": "Using a 10 mm open-ended spanner, remove the nut from the wedge pin on the fan-flap actuating lever and drive out the wedge pin. Withdraw the shaft with its linkage from the engine compartment.",
              "bold": false
            }
          ]
        },
        "es-ES": {
          "plain": "Con una llave fija de 10 mm, retirar la tuerca del pasador en cuña de la palanca de accionamiento de las compuertas del ventilador y sacar el pasador. Retirar el eje con su varillaje desde la cámara del motor.",
          "runs": [
            {
              "text": "Con una llave fija de 10 mm, retirar la tuerca del pasador en cuña de la palanca de accionamiento de las compuertas del ventilador y sacar el pasador. Retirar el eje con su varillaje desde la cámara del motor.",
              "bold": false
            }
          ]
        }
      },
      "label_keys": {
        "de": null,
        "en-GB": null,
        "es-ES": null
      }
    }
  ],
  "status": {
    "transcription": "validated",
    "en-GB": "validated",
    "es-ES": "validated",
    "figures": "not_applicable"
  }
}
