{
  "schema_version": 1,
  "id": "d65250c-page-050",
  "document_id": "d652-50c",
  "page": 50,
  "section": "B13",
  "type": "figures",
  "titles": {
    "de": "13. Zerlegen des Motors",
    "en-GB": "Section B.13 - Dismantling the engine",
    "es-ES": "Sección B.13 - Despiece del motor"
  },
  "source": {
    "image": "source.jpg",
    "pdf_spread": 27,
    "side": "left",
    "status": "extracted_clean",
    "display_image": "source_display.jpg"
  },
  "navigation": {
    "previous": "d65250c-page-049",
    "next": "d65250c-page-051"
  },
  "paragraphs": [],
  "figures": [
    {
      "id": "d65250c-bild079",
      "number": 79,
      "captions": {
        "de": {
          "plain": "Leitung aus der Motoreinführung ziehen und diese mit den Entstörrohren und dem Verteilerbogen abheben.",
          "runs": [
            {
              "text": "Leitung aus der Motoreinführung ziehen und diese mit den Entstörrohren und dem Verteilerbogen abheben.",
              "bold": false
            }
          ]
        },
        "en-GB": {
          "plain": "Pull the lead out of the engine entry point and lift it off together with the suppressor pipes and the distributor elbow.",
          "runs": [
            {
              "text": "Pull the lead out of the engine entry point and lift it off together with the suppressor pipes and the distributor elbow.",
              "bold": false
            }
          ]
        },
        "es-ES": {
          "plain": "Sacar el cable del punto de entrada al motor y retirarlo junto con los tubos antiparasitarios y el codo distribuidor.",
          "runs": [
            {
              "text": "Sacar el cable del punto de entrada al motor y retirarlo junto con los tubos antiparasitarios y el codo distribuidor.",
              "bold": false
            }
          ]
        }
      },
      "label_keys": {
        "de": null,
        "en-GB": null,
        "es-ES": null
      }
    },
    {
      "id": "d65250c-bild080",
      "number": 80,
      "captions": {
        "de": {
          "plain": "Handschrauben der Zylinderkopfhaubenbefestigung ausschrauben und Haube abheben.",
          "runs": [
            {
              "text": "Handschrauben der Zylinderkopfhaubenbefestigung ausschrauben und Haube abheben.",
              "bold": false
            }
          ]
        },
        "en-GB": {
          "plain": "Unscrew the hand screws of the cylinder-head cover fastening and lift off the cover.",
          "runs": [
            {
              "text": "Unscrew the hand screws of the cylinder-head cover fastening and lift off the cover.",
              "bold": false
            }
          ]
        },
        "es-ES": {
          "plain": "Desenroscar los tornillos de mano de la fijación de la tapa de culata y retirar la tapa.",
          "runs": [
            {
              "text": "Desenroscar los tornillos de mano de la fijación de la tapa de culata y retirar la tapa.",
              "bold": false
            }
          ]
        }
      },
      "label_keys": {
        "de": null,
        "en-GB": null,
        "es-ES": null
      }
    }
  ],
  "status": {
    "transcription": "validated",
    "en-GB": "validated",
    "es-ES": "validated",
    "figures": "not_applicable"
  }
}
