{
  "schema_version": 1,
  "id": "d65250c-page-037",
  "document_id": "d652-50c",
  "page": 37,
  "section": "B12",
  "type": "figures",
  "titles": {
    "de": "12. Ausbauen des Motors",
    "en-GB": "Section B.12 - Removing the engine",
    "es-ES": "Sección B.12 - Desmontaje del motor"
  },
  "source": {
    "image": "source.jpg",
    "pdf_spread": 20,
    "side": "right",
    "status": "extracted_clean",
    "display_image": "source_display.jpg"
  },
  "navigation": {
    "previous": "d65250c-page-036",
    "next": "d65250c-page-038"
  },
  "paragraphs": [],
  "figures": [
    {
      "id": "d65250c-bild053",
      "number": 53,
      "captions": {
        "de": {
          "plain": "Mit 19- und 22-Maulschlüssel an der oberen vorderen Rohranlage die Überwurfmutter der Leitung zum Wassertemperaturanzeiger entfernen.",
          "runs": [
            {
              "text": "Mit 19- und 22-Maulschlüssel an der oberen vorderen Rohranlage die Überwurfmutter der Leitung zum Wassertemperaturanzeiger entfernen.",
              "bold": false
            }
          ]
        },
        "en-GB": {
          "plain": "Using 19 mm and 22 mm open-ended spanners, remove the union nut of the line to the water-temperature gauge at the upper front pipe assembly.",
          "runs": [
            {
              "text": "Using 19 mm and 22 mm open-ended spanners, remove the union nut of the line to the water-temperature gauge at the upper front pipe assembly.",
              "bold": false
            }
          ]
        },
        "es-ES": {
          "plain": "Con llaves fijas de 19 y 22 mm, retirar la tuerca de unión de la línea al indicador de temperatura del agua en el conjunto de tubos delantero superior.",
          "runs": [
            {
              "text": "Con llaves fijas de 19 y 22 mm, retirar la tuerca de unión de la línea al indicador de temperatura del agua en el conjunto de tubos delantero superior.",
              "bold": false
            }
          ]
        }
      },
      "label_keys": {
        "de": null,
        "en-GB": null,
        "es-ES": null
      }
    },
    {
      "id": "d65250c-bild054",
      "number": 54,
      "captions": {
        "de": {
          "plain": "Schlauchbinder an der Vergaserglocke lösen, Handschrauben losschrauben und Glocke abheben. Dichtung beachten.",
          "runs": [
            {
              "text": "Schlauchbinder an der Vergaserglocke lösen, Handschrauben losschrauben und Glocke abheben. Dichtung beachten.",
              "bold": false
            }
          ]
        },
        "en-GB": {
          "plain": "Release the hose clip on the carburettor bell housing, unscrew the hand screws, and lift off the bell housing. Note the gasket.",
          "runs": [
            {
              "text": "Release the hose clip on the carburettor bell housing, unscrew the hand screws, and lift off the bell housing. Note the gasket.",
              "bold": false
            }
          ]
        },
        "es-ES": {
          "plain": "Aflojar la abrazadera de manguera de la campana del carburador, desenroscar los tornillos de mano y retirar la campana. Tener en cuenta la junta.",
          "runs": [
            {
              "text": "Aflojar la abrazadera de manguera de la campana del carburador, desenroscar los tornillos de mano y retirar la campana. Tener en cuenta la junta.",
              "bold": false
            }
          ]
        }
      },
      "label_keys": {
        "de": null,
        "en-GB": null,
        "es-ES": null
      }
    }
  ],
  "status": {
    "transcription": "validated",
    "en-GB": "validated",
    "es-ES": "validated",
    "figures": "not_applicable"
  }
}
