{
  "schema_version": 1,
  "id": "d65250c-page-087",
  "document_id": "d652-50c",
  "page": 87,
  "section": "B20",
  "type": "figures",
  "titles": {
    "de": "20. Nachstellen der Wasserpumpenwellenlagerung",
    "en-GB": "Section B.20 - Adjusting the water-pump shaft bearing",
    "es-ES": "Sección B.20 - Ajuste del cojinete del eje de la bomba de agua"
  },
  "source": {
    "image": "source.jpg",
    "pdf_spread": 45,
    "side": "right",
    "status": "extracted_clean",
    "display_image": "source_display.jpg"
  },
  "navigation": {
    "previous": "d65250c-page-086",
    "next": "d65250c-page-088"
  },
  "paragraphs": [],
  "figures": [
    {
      "id": "d65250c-bild153",
      "number": 153,
      "captions": {
        "de": {
          "plain": "Mit Hammer und Dorn den Kegelstift aus der Welle entfernen. Ringmutter so weit rechts herumdrehen, bis das Spiel der Lagerung aufgehoben und die Welle sich leicht drehen läßt. Kegelstift wieder einschlagen.",
          "runs": [
            {
              "text": "Mit Hammer und Dorn den Kegelstift aus der Welle entfernen. Ringmutter so weit rechts herumdrehen, bis das Spiel der Lagerung aufgehoben und die Welle sich leicht drehen läßt. Kegelstift wieder einschlagen.",
              "bold": false
            }
          ]
        },
        "en-GB": {
          "plain": "Using a hammer and drift, remove the taper pin from the shaft. Turn the ring nut to the right until the bearing play is taken up and the shaft turns easily. Drive the taper pin back in.",
          "runs": [
            {
              "text": "Using a hammer and drift, remove the taper pin from the shaft. Turn the ring nut to the right until the bearing play is taken up and the shaft turns easily. Drive the taper pin back in.",
              "bold": false
            }
          ]
        },
        "es-ES": {
          "plain": "Con un martillo y un botador, retirar la clavija cónica del eje. Girar la tuerca anular hacia la derecha hasta eliminar el juego del cojinete y que el eje gire con facilidad. Volver a introducir la clavija cónica a golpes.",
          "runs": [
            {
              "text": "Con un martillo y un botador, retirar la clavija cónica del eje. Girar la tuerca anular hacia la derecha hasta eliminar el juego del cojinete y que el eje gire con facilidad. Volver a introducir la clavija cónica a golpes.",
              "bold": false
            }
          ]
        }
      },
      "label_keys": {
        "de": null,
        "en-GB": null,
        "es-ES": null
      }
    }
  ],
  "status": {
    "transcription": "validated",
    "en-GB": "validated",
    "es-ES": "validated",
    "figures": "not_applicable"
  }
}
